<?xml version="1.0" encoding="UTF-8"?>
<bds xmlns="http://www.univ-rouen.fr/bd" xmlns:xsi="http://www.w3.org/2001/XMLSchema-instance"
	xsi:schemaLocation="http://www.univ-rouen.fr/bd BD.xsd ">
	<!-- À bout portant : Premier sang -->
	<bd>
		<!-- Informations -->
		<Informations>
			<Titre>Premier sang</Titre>
			<Serie>À bout portant</Serie>
			<Identifiant>1</Identifiant>
			<Scenario>Azzarello, Brian</Scenario>
			<Dessin> Risso, Eduardo </Dessin>
			<Couleurs>Goleash, Grant</Couleurs>
			<Editeur>Soleil Productions</Editeur>
			<Format>Grand format</Format>
			<ISBN>2-84565-138-4</ISBN>
			<Date>2002-01-19</Date>
		</Informations>

		<!-- Image -->
		<Image>http://www.bedetheque.com/media/Couvertures/aboutportantcouv01.jpg</Image>

		<!-- Description -->
		<Description> 
			Dizzy Cordova a tout perdu: son mari et son fils, tous deux victimes de la brutalité des gangs. A 
			peine sortie d'incarcération, la jeune femme est abordée par le mystérieux agent Graves. Ce dernier 
			lui offre la liste des vrais coupables, une arme, cent cartouches, mais surtout, lui garantit 
			l'immunité absolue. Dizzie empruntera-t-elle la voie de la rédemption, ou celle de la vengeance, au 
			risque de souiller son âme à jamais ?
		</Description>
	</bd>

	<bd>
		<!-- Informations -->
		<Informations>
			<Titre>Poupées Russes</Titre>
			<Serie>Lloyd Singer</Serie>
			<Identifiant>2</Identifiant>
			<Scenario>Brunschwig, Luc</Scenario>
			<Dessin>Neuray, Olivier</Dessin>
			<Couleurs>Cochet, Isabelle</Couleurs>
			<Editeur>Bamboo</Editeur>
			<Format>Grand format</Format>
			<ISBN>978-2-8189-0255-4</ISBN>
			<Date>2011-01-10</Date>
		</Informations>

		<!-- Image -->
		<Image>http://www.bedetheque.com/cache/thb_couv/Couv_121001.jpg</Image>

		<!-- Description -->
		<Description> 
			Elle s'appelle Zéna. En quittant sa Russie natale pour les États-Unis, elle croyait trouver amour et 
			opulence. Elle ne rencontra que l'enfer de la prostitution et de la pornographie. Après s'être enfuie
			pour protéger sa fille, Zéna est un témoin-clé pour le FBI. Mais Zéna a peur de tout, de tout le 
			monde, et ne veut pas parler… Il s'appelle Lloyd Singer. Son apparence malingre et insignifiante ne 
			reflète guère ses drames intimes. Orphelin à 13 ans, il a dû assumer seul la charge d'une famille, 
			sans jamais pouvoir s’offrir le luxe de l'égoïsme, et encaisser les coups des mauvais garçons de 
			Little Jerusalem. Aujourd'hui, il est comptable au FBI. Mais son véritable talent réside dans son 
			empathie. Lui seul saura établir un contact avec Zéna. Et si Lloyd Singer ne peut pas la protéger de 
			ses bourreaux, il reste Makabi, son alter ego. Makabi, le vengeur masqué, prêt à aller jusqu'au bout 
			pour protéger ceux qui souffrent… 
		</Description>
	</bd>
</bds>
